{
  "format": "ofti.run-manifest",
  "format_version": 1,
  "schema_version": 1,
  "manifest_kind": "ofti_run_manifest",
  "created_at": "2026-06-29T22:54:18Z",
  "updated_at": "2026-06-29T22:54:18Z",
  "case": {
    "name": "cavity",
    "path": "/work/cavity",
    "solver": "icoFoam",
    "parallel": {
      "enabled": false,
      "subdomains": 0
    }
  },
  "launch": {
    "name": "icoFoam",
    "command": "icoFoam",
    "background": true,
    "detached": false,
    "parallel": 0,
    "mpi": null,
    "pid": 12345,
    "returncode": null
  },
  "openfoam": {
    "bashrc": "/usr/lib/openfoam/openfoam2512/etc/bashrc",
    "version": "v2512"
  },
  "inputs": {
    "roots": ["system", "constant", "0"],
    "files": [],
    "tree_hash": "sha256-example",
    "mesh_hash": null,
    "recorded_inputs_copy": false,
    "inputs_copy_path": null
  }
}
